{
  "$schema": "../nafura-platform/sources/web/platform/schemas/app.nafura.schema.json",
  "apiVersion": "nafura.io/v1",
  "kind": "application",
  "metadata": { "id": "app.platform-host", "version": "0.1.0", "owner": "nafuralabs", "lifecycle": "experimental" },
  "spec": {
    "product": { "name": "Platform Host", "tagline": "Config + BCs", "mark": "/brand/mark.svg" },
    "runtime": { "tenancy": "multi", "signup": "operator", "defaultRoute": "/" },
    "shell": {
      "topBar": { "enabled": true, "pageContext": true },
      "sidebar": { "enabled": true },
      "userMenu": { "enabled": true, "userSettings": true },
      "tenantMenu": {
        "enabled": true,
        "tenantSettings": true,
        "tenantSettingsRoute": "/organization/settings",
        "organizationIdentity": true,
        "organizationIdentityRoute": "/organization/identity"
      },
      "notifications": { "enabled": true },
      "ai": { "enabled": true }
    },
    "businessContexts": ["bc.demo"],
    "capabilities": { "disabled": [] },
    "roles": [
      { "code": "DEMO_LEAD", "label": "Responsable démo", "includes": ["bc.demo:DEMO_EDITOR"] }
    ],
    "i18n": { "locales": ["fr"] },
    "local": {
      "ports": { "api": 8090, "web": 4400 },
      "organizations": [
        { "key": "org-a", "name": "Organisation A" },
        { "key": "org-b", "name": "Organisation B" }
      ],
      "users": [
        { "email": "admin@host.local", "givenName": "Host", "familyName": "Admin", "role": "SUPER_ADMIN" },
        { "email": "reader@host.local", "givenName": "Host", "familyName": "Reader", "role": "READER", "organizations": ["org-a"] },
        {
          "email": "lead@host.local",
          "givenName": "Demo",
          "familyName": "Lead",
          "role": "DEMO_LEAD",
          "organizations": [
            { "key": "org-a", "role": "DEMO_LEAD" },
            { "key": "org-b", "role": "DEMO_VIEWER" }
          ]
        },
        { "email": "viewer@host.local", "givenName": "Demo", "familyName": "Viewer", "role": "DEMO_VIEWER", "organizations": ["org-a"] }
      ]
    },
    "deploy": {
      "lab": { "operators": ["admin@host.local"] }
    }
  }
}
